The Shower In The Bathroom Didn't Seem To Work  Could Well Have Been Us Doing   Or Not Doing  Something Very Simple.,Yes,,Table D’Hôte,,,,,Strongly Agree,Strongly Agree,Strongly Agree,It Was A Very Good Meal With All The Courses Explained To Us As They Were Served.,,,,,,,,,,,,Strongly Agree,Strongly Agree,Strongly Agree,No One Member In Particular: All Were Polite And Helpful When Needed.,Agree,Strongly Agree,Exceeded,We Would Perhaps Have Liked To Have Seen  On The Portraits  A Note As To Who They Were. A Very  Very Minor Thing I Know.,The Overnight Stay  In Celebration Of My Husband's Birthday  Was A Delight. We Were Looked After Very Well And Look Forward To Returning For At Least An Afternoon Tea At Some Point. ,Female,65+,Special Offers,Accommodation,,,Events,,,Christmas,Lynda Vickery,
97,Complete,19/02/2014 14:20,Leisure,Stayed Previously,,,,,,,,,,,Www.Lewtrenchard.Co.Uk,Good,Maybe,Maybe,Good Overall. Staff Very Pleasant  Service Good. Food Wise Our Expectations Were A Bit More Than Was Delivered. ,Agree,Agree,Agree,,Agree,Agree,Neither Agree Nor Disagree,,Yes,,Table D’Hôte,,,,,Disagree,Agree,Disagree,It Was Fine But We Would Have Liked To Have Been Blown Away By The Food.,,,,,,,,,,,,Strongly Agree,Strongly Agree,Strongly Agree,,Neither Agree Nor Disagree,Agree,Met,Put 'Wow-Factor' In The Food!,,Female,55-64,Special Offers,,,,,,,,T Chipperfield,
98,Complete,20/02/2014 02:38,Leisure,Stayed Previously,,,,,,,,,,,Www.Lewtrenchard.Co.Uk,Good,Yes,Yes,Lovely Stay  Staff Very Friendly And Helpful.,Strongly Agree,Strongly Agree,Strongly Agree,,Agree,Agree,Strongly Agree,Would Like Tea And Coffee Making Facility In Room  Although Complimentary Available In Morning Which Was Great. Thanks!,Yes,,,,Bar Menu,,,Agree,Agree,Neither Agree Nor Disagree,Would Prefer More Choice For Bar Menu  But Food We Had Was Very Nice. We Don't Tend To Eat Large Meals With Several Courses.,,,,,,,,,,,,Strongly Agree,Agree,Agree,Not Sure Of Name  But Lady Who Showed Us To Our Room On Arrival. Very Nice  Polite And Friendly Throughout Stay.,Agree,Agree,Met,,,Female,45-54,Special Offers,,,,,,,,Christine Martin,
99,Complete,21/02/2014 04:29,Leisure,,,,,,,,,,,Other: Booking.Com,Other: ,Excellent,Definitely Yes,Definitely Yes,It Was Perfect  From The Welcome We Received Through To The Peace And Tranquility It Was The Perfect Escape. No Mobile Signal Was A Definite Perk! ,Strongly Agree,Strongly Agree,Strongly Agree,I Would Book Directly In Future  The Staff Were All So Hospitable And Helpful. It Really Was A Great Get Away And We Will Definitely Be Returning! ,Strongly Agree,Strongly Agree,Strongly Agree,,No,,,,,,,,,,,,,,,,,,,,,,Strongly Agree,Strongly Agree,Strongly Agree,The Lady Working On Reception When We Arrived  I Didn't Catch Her Name  But She Was Really Welcoming  Friendly And Made Us Feel At Home. ,Strongly Agree,Agree,Exceeded,,,Female,25-34,Special Offers,Accommodation,,,,,,,Rebecca Murch,
100,Complete,22/02/2014 06:38,Other: Valantines Day Celebration,,,,,,,Magazine/Newspaper Article,,,,,Called Direct,Good,Yes,Yes,Our Stay Was Enjoyable  The Staff Were Very Nice .I Felt That The Dining Room Was A Little On The Cold Side.Our Room Was Very Nice .The Little Touches Such As Flowers And Champagne Were Very Well Received.
                                                                                      Thank You Very Much,Strongly Agree,Strongly Agree,Strongly Agree,,Agree,Agree,Strongly Agree,,Yes,,,Tasting Menu,,,,Agree,Agree,Agree,,,,,,,,,,,,,Strongly Agree,Strongly Agree,Strongly Agree,The Gentleman Who Took My Booking On The Telephone And Was On Reception When We Checked Out Was Most Helpful.,Agree,Agree,Met,I Don't Think So.,We Would Like To Look Forward To A Future Visit.,Male,45-54,Special Offers,Accommodation,Restaurant,,,,Relaxation Therapy,,Steven Bailey,
101,Complete,23/02/2014 06:39,Leisure,Stayed Previously,,,,,,,,,,,Called Direct,Good,Maybe,Yes,At The Top End Of "Good"  Not Far Short Of "Excellent".,Agree,Agree,Agree,,Agree,Agree,Agree,We Were In St Gertrude.  Overall We Liked The Room A Lot.  When We Arrived After A Damp Journey  The Room Was Full Of Sunshine And Felt Particularly Welcoming.  A Couple Things To Think About  However:

(I) Some Sign Of Wear And Tear In The Bathroom (Eg Tiles Under Basin And On Floor).
(Ii) The Windows Do Not Shut Tightly  And In High Winds (Which Happened While We Were Staying) The Draft Appreciable.,Yes,,Table D’Hôte,Tasting Menu,,,,Agree,Agree,Agree,We Stayed Three Nights  Dining Twice Off The Table D'hote Menu  And Once With The Tasting Menu.  While The Food Was Very Good On All Three Occasions  The Extent Of Duplication Between The Table D'hote Menu And The Tasting Menu  And The Fact That The Table D'hote Menu Did Not Change Meant That By The Third Night We Found That Options That Avoided Repetition Were Limited.,,,,,,,,,,,,Agree,Agree,Agree,No  They Were All Good.,Neither Agree Nor Disagree,Agree,Met,It Is A Shame That The Open Fires Have To Be Hidden Behind The Large Metal Guards.  Perhaps This Could Be Overcome If The Fires Were A Bit Bigger.  On Our First Evening The Bar Felt Cold  Which Seemed Almost To Be Exacerbated By The Small Size Of The Fire In The Large Fireplace.  Make Them Big!  Let Them Roar!,I Woke On Our Last Morning Feeling Unwell.  Please Be Assured That I Put This Down To A Gastric Bug  Not Food Poisoning!  I Was Disappointed Not To Be Able To Have My Final Full Lewtrenchard Breakfast.,Male,45-54,,,,,,,,,Tim Lowth,... Please Select The Box
102,Complete,28/02/2014 05:46,Leisure,,,,,,,Magazine/Newspaper Article,,,,,Called Direct,Good,Maybe,Maybe,The Room Was Excellent And The Staff Were Very Pleasant And Efficient. The Room We Ate In On Our Arrival Was Rather Sterile And Lacked Any Atmosphere. We Were Surprised That Having Been Informed On The Phone And By E Mail That Jeans Were Not Acceptable Wear For Dining That There Were People In The Dining Room Wearing Jeans.,Strongly Agree,Disagree,Agree,,Strongly Agree,Neither Agree Nor Disagree,Strongly Agree,,Yes,,Table D’Hôte,,,,,Agree,Strongly Agree,Neither Agree Nor Disagree,As Before  The Large Room Was Devoid Of Any Atmosphere And Not Really Condusive To A Valentines Dinner,,,,,,,,,,,,Strongly Agree,Strongly Agree,Strongly Agree,,Neither Agree Nor Disagree,Agree,Fell Below,,,Male,55-64,,,,,,,,,Bill Lea,... Please Select The Box
