Response Id,Status,Completed Date,1. Why Did You Stay With Us?,2. How Did You Hear About Us? - Stayed Previously,3. How Did You Hear About Us? - Recommendation/Word Of Mouth,4. how did you hear about us? - lewtrenchard manor emails,5. How Did You Hear About Us? - Advertisement,6. How Did You Hear About Us? - Www.Lewtrenchard.Co.Uk,7. How Did You Hear About Us? - Internet Searches (E.G. Google  Yahoo  Etc.),8. How Did You Hear About Us? - Magazine/Newspaper Article,9. How Did You Hear About Us? - Organisation Booked,10. How Did You Hear About Us? - Social Media (E.G. Facebook  Twitter  Etc),11. How Did You Hear About Us? - Trip Advisor,12. How Did You Hear About Us? - Other,13. How Did You Make Your Reservation?,14. Your Overall Experience At Lewtrenchard Manor?,15. Stay At Lewtrenchard Manor In The Future?,16. Recommend Lewtrenchard Manor To Your Friends And/Or Colleagues?,17. How Would You Summarise Your Experience At Lewtrenchard Manor?,18. The Staff Were Friendly  Welcoming And Professional,19. The Ambience  Design And Interior Decoration Appealed To Me,20. The Atmosphere Was Warm And Friendly,21. Do You Have Any Other Comments Regarding Your Arrival And/Or Any Pre Arrival Contact?,22. The Room Was Luxurious And Well Appointed,23. There Was A Good Selection Of Products In My Bathroom,24. The Room Was Cleaned To A High Standard,25. Do You Have Any Other Comments Regarding Your Bedroom/Suite? Please Start Your Comment With Your Room/Suite Number.,26. Did You Dine With Us?,27. Did You Use The Spa Facilities?,28. Where Did You Dine? - Table D’Hôte,29. Where Did You Dine? - Tasting Menu,30. Where Did You Dine? - Bar Menu,31. Where Did You Dine? - Private Dining,32. Where Did You Dine? - Function Room,33. The Food Was Excellent,34. The Service Was Friendly & Professional,35. The Overall Dining Experience Was Exceptional,36. Do You Have Any Other Comments Regarding Lewtrenchard Manor As A Dining Venue?,37. Why Did You Visit The Spa At Lewtrenchard Manor?,38. The Staff Were Friendly And Professional,39. The Facilities Were Of A High Standard,40. The Overall Spa Experience Was Exceptional,41. The Quality Of The Treatments Were Of A High Standard,42. Do You Have Any Other Comments Regarding The Spa At Lewtrenchard Manor?,43. There Was Appropriate Meeting Support Material In The Room (E.G. Flip Charts  Pens  Etc.),44. We Were Able To Access The Internet Easily,45. Refreshments Were Delivered As Requested,46. Our Business Meeting Requirements Were Met,47. Do You Have Any Other Comments Regarding Lewtrenchard Manor As A Business Venue?,48. Were Polite And Courteous At All Times,49. Were Attentive To My Needs,50. Made Me Feel Well Looked After,51. Was There Any Particular Member Of The Team You Would Like To Acknowledge And Why?,52. You Were Sad To Leave,53. The Final Account Was Accurate,54. How Did Your Experience With Us Meet With Your Expectations?,55. Was There Anything Else That We Could Have Done To Enhance Your Overall Experience?,56. Do You Have Any Further Comments?,57. What Is Your Gender?,58. Which Of The Following Ranges Includes Your Age?,59. Would You Like To Receive Any Further Information From Lewtrenchard Manor Regarding? - Special Offers,60. Would You Like To Receive Any Further Information From Lewtrenchard Manor Regarding? - Accommodation,61. Would You Like To Receive Any Further Information From Lewtrenchard Manor Regarding? - Restaurant,62. Would You Like To Receive Any Further Information From Lewtrenchard Manor Regarding? - Weddings,63. Would You Like To Receive Any Further Information From Lewtrenchard Manor Regarding? - Events,64. Would You Like To Receive Any Further Information From Lewtrenchard Manor Regarding? - Conferences,65. Would You Like To Receive Any Further Information From Lewtrenchard Manor Regarding? - Relaxation Therapy,66. Would You Like To Receive Any Further Information From Lewtrenchard Manor Regarding? - Christmas,67. Please Complete The Following (Optional):,68. If You Do Not Want Us To Publish Your Review Online... - ... Please Select The Box
1,Complete,20/11/2013 14:42,Leisure,,Recommendation/Word Of Mouth,,,,,,,,,,Www.Lewtrenchard.Co.Uk,Excellent,Yes,Definitely Yes,The Best Hotel I Have Stayed At For Many Years Bar The Ritz In London. The Heating In The St Gertrudes Suite Is Very Noisy During The Night. It Stops You Completely Enjoying What Is A Unique Experience And Kept My Wife Awake Till 0500Hrs. We Both Overslept And Missed Your Amazing Breakfast If Anything Compared With Your Dinner The Night Before. ,Strongly Agree,Strongly Agree,Strongly Agree,,Strongly Agree,Strongly Agree,Strongly Agree,Please See Previous,Yes,,Table D’Hôte,,,,,Strongly Agree,Strongly Agree,Strongly Agree,Amazing Food Thank You,,,,,,,,,,,,Strongly Agree,Strongly Agree,Strongly Agree,All Very Polite And Very Helpful,Strongly Agree,Strongly Agree,Exceeded,,,Male,45-54,Special Offers,,,,,,,,Dave Green,
2,Partial,21/11/2013 02:37,,,,,,,,,,,,,,,,,,,,,,,,,,,,,,,,,,,,,,,,,,,,,,,,,,,,,,,,,,,,,,,,,,,,
3,Complete,21/11/2013 03:12,Private Celebration,,,,,,Internet Searches (E.G. Google  Yahoo  Etc.),,,,,,Www.Lewtrenchard.Co.Uk,Excellent,Definitely Yes,Definitely Yes,Magnificent! Hotel  Service And Food Excellent ,Strongly Agree,Strongly Agree,Strongly Agree,No All Fine. ,Strongly Agree,Strongly Agree,Strongly Agree,,Yes,,Table D’Hôte,,,,,Strongly Agree,Strongly Agree,Strongly Agree,I Eat At Many Top Restaurants In London  Aboard Etc - And Thought The Food  Presentation And Service Exceptional. ,,,,,,,,,,,,Strongly Agree,Strongly Agree,Strongly Agree,All Of A High Standard. ,Strongly Agree,Strongly Agree,Exceeded,No,,Male,35-44,,,,,Events,,,,Dan Tisdall ,
4,Complete,21/11/2013 03:33,Leisure,,,,,,Internet Searches (E.G. Google  Yahoo  Etc.),,,,,,Called Direct,Excellent,Definitely Yes,Definitely Yes,We Really Appreciate Getting Away And Relaxing With Good Food And Wine Plus The Added Bonus Of A Really Special Manor Both In Its History And Architectural Value. The Service Of Friendly And Polite Staff Was An Added Bonus. Thank You For A Most Enjoyable Stay Much Appreciated. ,Strongly Agree,Strongly Agree,Strongly Agree,None At All,Agree,Strongly Agree,Agree,St Gertrude Was A Delight The Bath Was Scratched Badly And A Floor Tile Cracked But We Only Stayed One Night So It Was Not An Issue,Yes,,Table D’Hôte,,,,,Agree,Strongly Agree,Agree,,,,,,,,,,,,,Strongly Agree,Strongly Agree,Strongly Agree,All The Team Were A Delight,Strongly Agree,Strongly Agree,Met,No,,Female,55-64,Special Offers,,Restaurant,,,,,,Mr And Mrs Dagworthy,... Please Select The Box
5,Complete,21/11/2013 11:06,Private Celebration,,,,,,,,,,,Lunched Previously,Called Direct,Excellent,Yes,Definitely Yes,Very Relaxed And Attentive.,Strongly Agree,Strongly Agree,Strongly Agree,No,Agree,Agree,Strongly Agree,,Yes,,Table D’Hôte,,,,,Agree,Agree,Agree,An A La Carte Menu Would Have Been Nice And We Were Not Offered A Tasting Menu.,,,,,,,,,,,,Strongly Agree,Strongly Agree,Strongly Agree,,Agree,Agree,Exceeded,No,No,Male,65+,Special Offers,,Restaurant,,,,,,Mr. R. G. Spiller,
6,Complete,23/11/2013 13:28,Leisure,,Recommendation/Word Of Mouth,,,,Internet Searches (E.G. Google  Yahoo  Etc.),,,,,,Emailed Direct,Excellent,Definitely Yes,Definitely Yes,Relaxed And  Very Comfortable With Excellent Food And Wine,Strongly Agree,Strongly Agree,Strongly Agree,You Were Very Accommodating When I Was Trying To Solve The Problem Of Having A Dog With Us Which We Couldn't Leave In Our Car Or A Dog Cage At Meal Times Because We Were On A Walking Break.,Strongly Agree,Strongly Agree,Strongly Agree,,Yes,,Table D’Hôte,,,,,Strongly Agree,Strongly Agree,Strongly Agree,,,,,,,,,,,,,Strongly Agree,Strongly Agree,Strongly Agree,,Strongly Agree,Disagree,Exceeded,I Am Struggling To Think Of Anything!,,Female,55-64,Special Offers,,Restaurant,,Events,,,Christmas,Jane Ward,... Please Select The Box
7,Complete,25/11/2013 11:12,Leisure,,,,,,,,,,,Times Restaurants Supplement,Called Direct,Excellent,Yes,Definitely Yes,A Hotel Of Character And Tranquility In A Lovely Setting With Extremely Friendly Staff.,Strongly Agree,Strongly Agree,Strongly Agree,,Strongly Agree,Strongly Agree,Strongly Agree,,Yes,,Table D’Hôte,,,,,Agree,Strongly Agree,Agree,,,,,,,,,,,,,Strongly Agree,Strongly Agree,Strongly Agree,,Strongly Agree,Agree,Exceeded,,,Male,65+,Special Offers,Accommodation,,,,,,,John Triance,
8,Complete,25/11/2013 11:11,Leisure,,,,,,,,,,,Good Food Guide,Www.Lewtrenchard.Co.Uk,Excellent,Definitely Yes,Definitely Yes,Everything Was Excellent. Friendly Professional Staff. Great Attention To Detail. Food Was Really Good.,Strongly Agree,Strongly Agree,Strongly Agree,,Agree,Agree,Agree,It Was Cold  And We Had To Turn The Electric Radiator On As Well.,Yes,,Table D’Hôte,,,,,Strongly Agree,Strongly Agree,Strongly Agree,,,,,,,,,,,,,Strongly Agree,Strongly Agree,Strongly Agree,No These Comments Apply To All The Staff.,Agree,Agree,Exceeded,Put The Radiator On Before We Arrived.,,Male,65+,Special Offers,,,,Events,,,,Theo Schofield,
9,Complete,26/11/2013 03:58,Leisure,,,,,,Internet Searches (E.G. Google  Yahoo  Etc.),,,,,,Called Direct,Good,Maybe,Maybe,Location Excellent. Food Superb  Service Good  Room Cold,Strongly Agree,Agree,Agree,All Good,Neither Agree Nor Disagree,Agree,Agree,,Yes,,,,,Private Dining,,Strongly Agree,Strongly Agree,Strongly Agree,,,,,,,,,,,,,Strongly Agree,Agree,Agree,,Neither Agree Nor Disagree,Agree,Met,,,Male,65+,Special Offers,Accommodation,Restaurant,,,,,,Penfold,
10,Complete,28/11/2013 09:40,Leisure,,,,,Www.Lewtrenchard.Co.Uk,,,,,,,Www.Lewtrenchard.Co.Uk,Excellent,Definitely Yes,Definitely Yes,We Enjoyed Our Visit Enormously. The Murray Family's Personal Welcome And Very Professional But Charming "Hands On" Approach Was Unique In Our Experience! All The Staff Were Lovely And We Noticed They Are Local Which Is Marvellous. The Manor  Rooms And Gardens Are Absolutely Beautiful And Historically Very Interesting. Everything Is Done To Make The Visitor's Stay As Relaxing And Comfortable As Possible  All Our Meals Were Exceedingly Delicious And Service Was Given With An Attention To Every Detail. ,Strongly Agree,Strongly Agree,Strongly Agree,We Were Impressed That In Parking Outside Our Arrival Was Noticed And Mrs Murray Came To The Door To Welcome Us. This Is Unique In Our Experience. Before Arriving We Also Received An Email Asking If We Had Any Requests Which Is Very Unusual.,Strongly Agree,Strongly Agree,Strongly Agree,Our Suite (Geraldine) Was Beautiful But  As It Was Exceeding Cold Outside  A Little Chilly At Night As It Has Windows On 3 Sides. It Did Have An Additional Portable Radiator But Perhaps Another Is Needed?,Yes,,Table D’Hôte,,,,,Strongly Agree,Strongly Agree,Strongly Agree,Intimate But Spacious And Beautiful Rooms. ,,,,,,,,,,,,Strongly Agree,Strongly Agree,Strongly Agree,Mr And Mrs Murray  Duncan  And Resident Jack Russell For Their Charming Welcome And Good Humour!,Strongly Agree,Strongly Agree,Exceeded,,We Look Forward To Visiting Again - Thank You!,Female,45-54,Special Offers,,,,,,,,Zoe & Tom Trevor,
11,Partial,28/11/2013 09:39,,,,,,,,,,,,,,,,,,,,,,,,,,,,,,,,,,,,,,,,,,,,,,,,,,,,,,,,,,,,,,,,,,,,
12,Complete,28/11/2013 10:30,Private Celebration,,,,,,,,,,,Have Dined There Previously,Called Direct,Excellent,Definitely Yes,Definitely Yes,We Loved It And Hope To Be Back Soon.,Strongly Agree,Strongly Agree,Strongly Agree,Everything Was Perfect.,Strongly Agree,,Strongly Agree,We Asked For A Room That Had An Old-Fashioned Feel But A Large Comfortable Bed  And Horsea Was Recommended To Us. We Loved It! It Was Perfect For Our Needs  And Wonderfully Romantic.,Yes,,,,,,,Strongly Agree,Strongly Agree,Strongly Agree,We've Becoming Here For Years For Special Celebrations. It's Lovely That The Manor Is In The Hands Of The Murray Family Again. ,,,,,,,,,,,,Strongly Agree,Strongly Agree,Strongly Agree,Everyone Was Lovely.,Strongly Agree,Strongly Agree,Exceeded,,I Just Wanted To Note That As A Folklorist (And A Novelist/Artist Who Works With Folklore)  Sabine Baring-Gould Is A Major Figure In Our Field For Having Done So Much To Collect And Preserve The Tales And Folksongs Of The Old Moor Dwellers. So That Adds A Special Element To Visiting Lewtrenchard For Me And My Husband. (Plus  I've Read And Enjoyed Laurie R. King's Mystery Novel  The Moor  Set In Lewtrenchard.)  A Number Of Us In The Folklore/Arts Community In Chagford Love To Come To Lewtrenchard For Special Celebrations (Brian & Wendy Froud  Elizabeth-Jane Baldry  And Others)  And Often Recommend It To Our Guests Visiting From America. (Our American Writing Colleagues Ellen Kushner And Delia Sherman Recently Stayed With You  For Example.) Lewtrenchard Is Magical And We Love It. If You're Interested  You Can See Some Of The Pictures I Took During Our Stay On My Writing Blog: Http://Windling.Typepad.Com/Blog/2013/11/Lewtrenchard.Html,Female,45-54,Special Offers,,,,Events,,,,Terri Windling And Howard Gayton,
13,Complete,28/11/2013 11:50,Private Celebration,,,,,,,,,,Trip Advisor,,Called Direct,Excellent,Definitely Yes,Definitely Yes,Spoilt From Arival To Departure   Really Made To Feel Relaxed And At Home From The Murray Family And All The Staff     Fantastic Food And Service And Such  Beautiful Hotel And Surroundings Cant Wait To Return!,Strongly Agree,Strongly Agree,Strongly Agree,,Strongly Agree,Strongly Agree,Strongly Agree,Seymor.  Did Mention At Time For Your Records But During The Day And Worse Of All At Night The Sound Of Heating Pipes Expanding And Contracting  We Can Only Describe As  A Constant  Sound Like Tap Dripping Onto A Hard Surface . Smell Of Heating Fuel In Ouside Lobby,Yes,,,,,,,Strongly Agree,Strongly Agree,Strongly Agree,,,,,,,,,,,,,Strongly Agree,Strongly Agree,Strongly Agree,All Very Good ,Strongly Agree,Strongly Agree,Exceeded,,We Would  Once Again Like To Thank Everyone In Making Our 35Th Wedding Anniversary An Enjoyable Time.,Male,55-64,Special Offers,Accommodation,,,Events,,,,Brian Peters,
14,Complete,28/11/2013 13:05,Leisure,Stayed Previously,,,,,,,,,,,Called Direct,Excellent,Definitely Yes,Definitely Yes,Lovely Food  Nice Room  Relaxed Atmosphere And Good Value.,Strongly Agree,Strongly Agree,Agree,,Agree,Strongly Agree,Strongly Agree,Aurelia. Nice Bathroom And Extremely Comfortable Bed,Yes,,Table D’Hôte,Tasting Menu,,,,Strongly Agree,Agree,Agree,Thoroughly Deserves Its 3 Aa Rosettes,,,,,,,,,,,,Strongly Agree,Agree,Agree,,Strongly Agree,Strongly Agree,Exceeded,One Minor Quibble Only: The Fresh Fruit At Breakfast Is Not Up To The Excellent Standard Of The Rest Of The Food,We've Stayed 3 Times Now  Introduced 3 Lots Of Friends And Look Forward To Staying Again,Male,55-64,Special Offers,Accommodation,,,,,,,Steve & Karen Hawkins,
15,Complete,29/11/2013 05:01,Business/Meeting,Stayed Previously,,,,,,,,,,,Called Direct,Excellent,Definitely Yes,,Lovely,Strongly Agree,Strongly Agree,Strongly Agree,,Strongly Agree,Agree,Strongly Agree,Was Lovely And Warm But Perhaps Too Warm.Thermostat Could Be Turned Down A Little,Yes,,,Tasting Menu,,,,Strongly Agree,Strongly Agree,Strongly Agree,,,,,,,,Neither Agree Nor Disagree,Neither Agree Nor Disagree,Strongly Agree,Agree,Internet Bit Slow,Strongly Agree,Strongly Agree,Strongly Agree,All Were Fab,Disagree,Strongly Agree,Met,,,Female,25-34,,,,,,,,,,... Please Select The Box
16,Partial,29/11/2013 06:10,Private Celebration,,,,,Www.Lewtrenchard.Co.Uk,,,,,,,Www.Lewtrenchard.Co.Uk,Excellent,Definitely Yes,Definitely Yes,Warm Welcome! Excellent Hospitality! Super Food! Great Place To Relax! ,Strongly Agree,Strongly Agree,Strongly Agree,Murray Junior Made Us Most Welcome ( Sorry Forgot His Christian Name),Strongly Agree,Agree,Strongly Agree,,Yes,,Table D’Hôte,,,,,Strongly Agree,Strongly Agree,Strongly Agree,,,,,,,,,,,,,,,,,,,,,,,,,,,,,,,,,
17,Complete,29/11/2013 06:27,Private Celebration,,,,,Www.Lewtrenchard.Co.Uk,,,,,,,Www.Lewtrenchard.Co.Uk,Excellent,Definitely Yes,Definitely Yes,Excellent  Great Hotel For A Getaway!!,Strongly Agree,Strongly Agree,Strongly Agree,Made Very Welcome By Mr Murray Junior ( Sorry Forget Christian Name),Strongly Agree,Strongly Agree,Strongly Agree,Melton,Yes,,Table D’Hôte,,,,,Strongly Agree,Strongly Agree,Strongly Agree,,,,,,,,,,,,,Strongly Agree,Strongly Agree,Strongly Agree,Murray Family...............Nice Folks,Strongly Agree,Strongly Agree,Exceeded,,,Male,45-54,Special Offers,,,,,,,,Mike & Sal Thomas,... Please Select The Box
18,Complete,29/11/2013 07:55,Leisure,,Recommendation/Word Of Mouth,,,,,,,,,,Called Direct,Excellent,Definitely Yes,Definitely Yes,Excellent Evening Wonderful Food Very Friendly Atmosphere,Strongly Agree,Agree,Strongly Agree,,,,,N/A,Yes,,Table D’Hôte,,,,,Strongly Agree,Strongly Agree,Strongly Agree,Excellent Venue,,,,,,,,,,,,Strongly Agree,Strongly Agree,Strongly Agree,No,,Strongly Agree,Met,No,No,Female,65+,Special Offers,,Restaurant,,,,,,Simpkin,
19,Complete,29/11/2013 08:47,Leisure,Stayed Previously,,,,,,,,,,,Called Direct,Excellent,Definitely Yes,Definitely Yes,Luxurious  Relaxing  Divine  Ticked All The Boxes.,Strongly Agree,Strongly Agree,Strongly Agree,,Strongly Agree,Strongly Agree,Strongly Agree,St Gertrude - Spotless  Tastefully Decorated  Extremely Relaxing.   If I Had To Give A Negative Comment The Only One Would Be That The Room Was A Little Cold On Our Arrival  However It Was An Extemely Cold Day And Once The Curtains Were Drawn It Was Warm And Cosy.,Yes,,Table D’Hôte,,,,,Strongly Agree,Strongly Agree,Agree,Having Stayed Before We Knew Exactly What To Expect And The Food Is Wilthout A Doubt Absolutely Exquisite.   Last Time We Stayed We Had Quite A Giggle When My Husband Was Served With 1 Carrot And This Time Hooted With Laughter When He Had Half A Sprout.   This Is Of Course Part Of The Fine Dining Experience - The Tastes And Presentation Being 2Nd To None.    ,,,,,,,,,,,,Strongly Agree,Strongly Agree,Strongly Agree,Everyone Should Be Commended - Superb Service.,Strongly Agree,Strongly Agree,Exceeded,Taking Us Hostage For A Few Days Would Have Been Very Nice Thank You!,We First Stayed At Lewtrenchard On Our Honeymoon In 1995   We Then Returned About 48 Hours Before My Daughter Was Born - She Is Now 17.   Three Years Ago We Celebrated Our 15Th Wedding Anniversary With You And This Time We Stayed Just Because!!,Female,45-54,Special Offers,,,,,,,,Jeremy And Karina Robins,
20,Complete,30/11/2013 15:45,Leisure,,Recommendation/Word Of Mouth,,,,,,,,,,Called Direct,Excellent,Definitely Yes,Definitely Yes,Excellent   Good Value,Strongly Agree,Agree,Agree,,Agree,Agree,Strongly Agree,Shower Underpowered ,Yes,,,,,,,Strongly Agree,Agree,Agree,,,,,,,,,,,,,Agree,Agree,Agree,,Neither Agree Nor Disagree,Agree,Met,,,Male,55-64,Special Offers,Accommodation,Restaurant,,,,,,Coker,
21,Complete,02/12/2013 05:18,Private Celebration,,,,,,,Magazine/Newspaper Article,,,,,Called Direct,Excellent,Definitely Yes,Definitely Yes,Thoroughly Enjoyable Experience. Great Setting  Friendly And Helpful Staff  Excellent Food.,Strongly Agree,Strongly Agree,Strongly Agree,Couldn't Have Been Bettered,Agree,Agree,Strongly Agree,Merial (?) Room In The Outhouse. The Only Complaint Is That The Bath Water Ran In Extremely Slowly.,Yes,,Table D’Hôte,,,,,Strongly Agree,Strongly Agree,Strongly Agree,,,,,,,,,,,,,Strongly Agree,Strongly Agree,Strongly Agree,,Agree,Strongly Agree,Met,Expectations Were High Following A Sunday Times Article Listing The Hotel As One Of The 20 Most Romantic Dining Experiences In The Uk - It Was Our 28Th Wedding Anniversary!,,Male,55-64,Special Offers,,Restaurant,,,,,,Graesser,
22,Partial,03/12/2013 05:43,,,,,,,,,,,,,,,,,,,,,,,,,,,,,,,,,,,,,,,,,,,,,,,,,,,,,,,,,,,,,,,,,,,,
23,Complete,09/12/2013 05:50,Leisure,Stayed Previously,,,,,,,,,,,Called Direct,Good,Maybe,Yes,Pleasant And Picturesque Place To Stay  Nice Staff Great Location For Exploring The Mid South West.,Strongly Agree,Agree,Agree,It Was A Good Experience,Agree,Agree,Agree,The Shower Stall Had Poor Grouting Along The Lower Tiles Which Were Perhaps Loose And The Tile Floor Was Poorly Grouted,No,,,,,,,,,,,,,,,,,,,,,,Agree,Agree,Agree,The Lady At Reception Was Very Attentive And Pleasant,Neither Agree Nor Disagree,Neither Agree Nor Disagree,Met,,There Should Be An Addition On Your Site To Get  Vouchers And Or Discounts For Additional Visits From Customers. This Has Proven To Be An Effective Way Of Maintaining Sales Through The Winter Season And Increasing Year Round Sales( In My Country),Male,55-64,Special Offers,,,,,,,,,... Please Select The Box
24,Complete,09/12/2013 07:14,Leisure,Stayed Previously,,,,,,,,,,Had Our Wedding With You 4/12/2010,Emailed Direct,Excellent,Definitely Yes,Definitely Yes,Fantastic As Always.,Strongly Agree,Strongly Agree,Strongly Agree,,Strongly Agree,Strongly Agree,Strongly Agree,,Yes,,,,,,,Strongly Agree,Strongly Agree,Strongly Agree,,,,,,,,,,,,,Strongly Agree,Strongly Agree,Strongly Agree,,Strongly Agree,Strongly Agree,Exceeded,,It Was Great That You Delivered Tea To Our Room After Dinner.,Female,45-54,Special Offers,,,,,,,Christmas,Alison Brady,
25,Complete,09/12/2013 14:03,Leisure,,Recommendation/Word Of Mouth,,,,,,,,,,Called Direct,Excellent,Definitely Yes,Definitely Yes,Excellent Welcome Lovely Staff And First Class Cuisine. Felt At Ease At All Times And All Staff Pleasant Helpful Professional With Nothing Being Too Much Trouble.,Strongly Agree,Agree,Strongly Agree,Perfect,Agree,Strongly Agree,Strongly Agree,Gertrude Loved It.,Yes,,Table D’Hôte,,,,,Strongly Agree,Strongly Agree,Strongly Agree,,,,,,,,,,,,,Strongly Agree,Strongly Agree,Strongly Agree,Young Waitress Whose Name I Have Forgotten. Farmer's Daughter At College Wishing To Be A Farm Secretary. Very Sweet Polite And Helpful.,Strongly Agree,Strongly Agree,Exceeded,, We Have Already Recommended To Friends/Family  And Will Return Ourselves.,Male,55-64,Special Offers,,,,,,,,Ian Radford,
26,Complete,10/12/2013 13:56,Leisure,Stayed Previously,,,,,,,,,,,Called Direct,Excellent,Definitely Yes,,Usual Warm Welcome. All Of The Staff Are Excellent. The Menu Now Has The Stamp Of The 'New' Chef  And Both Of Our Dinners Were Excellent. ,Strongly Agree,Strongly Agree,Strongly Agree,,Strongly Agree,Strongly Agree,Strongly Agree,,Yes,,Table D’Hôte,,,,,Strongly Agree,Strongly Agree,Strongly Agree,Suggestion To Diners That Smart Casual Attire Would Be Nice (No Jeans Or Trainers).,,,,,,,,,,,,Strongly Agree,Strongly Agree,Strongly Agree,All Excellent.,Agree,Strongly Agree,Met,,,Male,,Special Offers,Accommodation,Restaurant,,Events,,,,,... Please Select The Box
27,Partial,21/12/2013 03:31,,,,,,,,,,,,,,,,,,,,,,,,,,,,,,,,,,,,,,,,,,,,,,,,,,,,,,,,,,,,,,,,,,,,
28,Partial,21/12/2013 06:55,,,,,,,,,,,,,,,,,,,,,,,,,,,,,,,,,,,,,,,,,,,,,,,,,,,,,,,,,,,,,,,,,,,,
29,Partial,21/12/2013 05:34,Leisure,,,,,,Internet Searches (E.G. Google  Yahoo  Etc.),,,,,,Www.Lewtrenchard.Co.Uk,,,,,,,,,,,,,,,,,,,,,,,,,,,,,,,,,,,,,,,,,,,,,,,,,,,,,,,
30,Partial,21/12/2013 05:41,Leisure,,Recommendation/Word Of Mouth,,,,,,,,,,Other: ,Good,Yes,Yes,,Strongly Agree,Strongly Agree,Strongly Agree,,Strongly Agree,Strongly Agree,Strongly Agree,,No,,,,,,,,,,,,,,,,,,,,,,,,,,,,,,,,,,,,,,,,,,
31,Complete,21/12/2013 10:07,Leisure,Stayed Previously,,,,,,,,,,,Called Direct,Excellent,Definitely Yes,Definitely Yes,Very Welcoming And Relaxing Short Break Where We Were Taken Care Of Superbly.,Strongly Agree,Strongly Agree,Strongly Agree,,Strongly Agree,Strongly Agree,Strongly Agree,We Would Always Prefer To Have A Courtesy Tray With Tea/Coffee/Kettle/Fresh Milk/Bottled Water/Biscuits In Our Room. We Would Also Always Desire To Have A Small Fridge Or Mini Bar. ,Yes,,Table D’Hôte,,,,,Strongly Agree,Strongly Agree,Strongly Agree,,,,,,,,,,,,,Strongly Agree,Strongly Agree,Strongly Agree,,Agree,Strongly Agree,Met,See Comments Above,,Male,55-64,,,,,,,,,Steve And Jane Epperson,
32,Complete,22/12/2013 02:13,Leisure,Stayed Previously,,,,,,,,,,,Called Direct,Excellent,Definitely Yes,Definitely Yes,Good,Strongly Agree,Strongly Agree,Strongly Agree,,Agree,Agree,Agree,,Yes,,,,,,,Agree,Strongly Agree,Agree,,,,,,,,,,,,,Strongly Agree,Strongly Agree,Strongly Agree,,Agree,Agree,Met,,,Male,55-64,,,,,,,,,David Bryant,... Please Select The Box
33,Complete,22/12/2013 06:13,Business/Meeting,,,,,,,,,,,Local To Area,Other: ,Excellent,Definitely Yes,Definitely Yes,Very Good Service. ,Strongly Agree,Strongly Agree,Strongly Agree,,Agree,Agree,Strongly Agree,,No,,,,,,,,,,,,,,,,,,Strongly Agree,,,,Strongly Agree,Strongly Agree,Strongly Agree,,Agree,Strongly Agree,Exceeded,,,Male,35-44,,,,,,,,,,... Please Select The Box
34,Complete,22/12/2013 12:34,Leisure,,,,,,Internet Searches (E.G. Google  Yahoo  Etc.),,,,,,Other: ,Excellent,Definitely Yes,Definitely Yes,Very Relaxing And A Real 'Treat' Excellent Staff Vey Professional,Strongly Agree,Strongly Agree,Strongly Agree,Excellent Mince Pie!!,Strongly Agree,Agree,Strongly Agree,Needs A Rail For Towel Next To Shower As I Had To Petition The Floor  We Liked The Bath   Room For !,No,,,,,,,,,,,,,,,,,,,,,,Strongly Agree,Strongly Agree,Strongly Agree,,Strongly Agree,Disagree,Exceeded,Would Prefer By Breakfast 'Haddock And Egg' On A Plate As It Was Hard To Eat  Out Of A Dish (Although It Looked Good!)And Impossible To Have 'On Toast' As Would Have Been My Preference ,We Have Never Stayed In A 'Posh' Hotel Before As Generally It Is Beyond Our Means  However We Felt It Was  For Many And Worth Saving For   A Real Treat!  Your Staff Put Us At Ease Even Though We Are Not Familiar With Correct Etiquette For A Smart Hotel.,Female,45-54,Special Offers,,Restaurant,,,,,,Tim And Sarah Earle-Marsh,
