,Filters Applied,,,,,,,
,816,The Staff Was Very Well Trained And Professional.,,,,,,
,823,Portion Size Improvement On Previous Visits,,,,,,
,826,Perhaps Another Starter As Only Three,,,,,,
,829,The Food Was A 6 Out Of 10. Ok But Not Memorable.,,,,,,
,830,Possibly May Need To Look At Breakfast Portion Sizes - I Know You Have To Keep An Eye On Costs But 1 Small Mushroom And Only 2 Triangles Of Toast (So 1 Slice) And No Hash Browns Weren't Quite To The Standards I'd Hoped For. ,,,,,,
,832,Comments As Previously Made On This Form.,,,,,,
,833,Excellent Atmosphere  Great Food  Wonderful Service.,,,,,,
,838,My Husband Has Recently Had A Heart Attack And Wasn't Up To Having Breakfast Downstairs - Staff Very Happy To Bring To Our Room (33) - A Lovely Treat To Have Breakfast In Bed!! Again Thank You.,,,,,,
,843,5 Course Tasting Menu Delicious. Fresh Fruit Salad At Breakfast Disappointing ,,,,,,
,844,The Gin And Tonic Recommended Was Excellent.  The Food Was Slightly Too Salted For My Taste But Not Unpleasant.  I Sateyd Two Nights And So The Chopices Were Limited - A Few More Main Courses Or A Changing Menu Would Be Welcome.,,,,,,
,846,The Waiter Was Great And Recommended A Lovely Gin. He Made Our Evening.,,,,,,
,847,See Previous Comments,,,,,,
,848,Upon My Request For A Meat Free Meal  I Was Not Disappointed In Any Way.  We Both Felt Like We Had A Very Special Treat!,,,,,,
,850,Dinner Service Was Poor For The Second Time  Head Waiter Was Grumpy As Was The Waitress. It Doesn't Matter How Good The Food Is If The Person Serving It Is Clearly Not Enjoying Themselves.   Breakfast Was Great Staff Very Friendly,,,,,,
,852,Very Pleasantly Surprised With The Content Of The Menu And The Quality And Presentation Of The Food. Excellent Value For Money,,,,,,
,854,Dinner Was Not Memorable  Breakfast Was,,,,,,
,857,Let Down By Dining Room Staff. ,,,,,,
,858,As Before   Lovely Setting  Good Food  The Service Could Be Sharper,,,,,,
,862,Told We Had Booked The Taster Menu~ Untrue. Used The A La Carte With Its Limited Offering . Seasonal Greens Were Ordered As A Side And Were Not Edible As Was The Over Balance Of Greens Already On Plate. Waitress Was Pleasant But Obviously Inexperienced . The Hovering Suited Male Was Not Interested In His Customers,,,,,,
,866,Both Evening Meal And Breakfast Were Excellent. We Did Have Three Attempts On Getting Our Evening Meal  But It Was  Not An Issue And The Staff Were Very Good In The Way They Handled The Mistake. Breakfast Was Obviously Cooked To Order And Very Tasty,,,,,,
,869,Outstanding!  I Need The Recipe For Those Duck Fat Potatoes!!!  We Loved Absolutely Every Meal And Were Very Impressed With Our Dining Experiences.,,,,,,
,871,The Staff Were Very Attentive ,,,,,,
,876,We Were Looking Forward To The Pancakes For Breakfast  But These Were "Finished" When We Arrived  My Wife's Next Choice Was Also Off The Menu  So She Went For The Kippers Which Were A Nice Third Choice. There Were No Water Glasses On The Tables And We Had To Ask For Them Which Took Ten Minutes As They Were Too Busy To Check On Us! We Also Had To Ask For Orange Juice  And When I Asked For A Coffee  It Never Arrived  And The Restaurant  Shut With No One Checking If Everything Was Ok!  Dinner Was Excellent And Very Enjoyable - The Gin Fusion Menu Was Superb  But The Desert Was A Let Down And A Complete Contrast To The Starter And Meal - You Would've Got A 'Strongly Agree' If The Desert Was Up To The Same Standard.,,,,,,
,877,The Sampling Menu Was Good  However The Fillet Beef Was Really Not Up To Scratch... It Was Cooked Perfectly But A Rather Tough Piece Of Meat. The Dessert - Chocolate -  Was A Bit Too Large & Very Rich. ,,,,,,
,882,Breakfast Wasn't Particularly Allergy Friendly - As A Lacto An Gluten Intolerant Person It Was Quite Tricky Finding Something To Eat. I'd Suggest Spelt Bread As An Easy Solution With Salmon And Eggs For Example. ,,,,,,
,884,The Food Was Not Of Previous High Standard. The Service Was Very Slow   Even At Breakfast - I Do Appreciate It Was Being Individually Prepared. The Staff Were Friendly But Not Professional.,,,,,,
,887,Dinner Was Average.....And Disappointing For The Price. Breakfast Self-Service Was Fair. The Cooked Breakfast On Both Mornings Was Not As Ordered  Despite Repeating To Ensure The Waitress Had Taken The Order Correctly. Breakfast Took Far To Long To Come Give That You Were Well Staffed And Had A Low Cover Count Both Days When We Ate. Coffee Was Very Poor On The Sunday. ,,,,,,
,889,New Year's Eve Was Great. However We Mentioned At Reception The Previous Evening Being Somewhat Scatty And Remarkably Slow. We Were A Party Of 8 - Not That Many. 3/4 Hour After We Sat Down We Still Had No Bread. The Meal Was So Slow We Left At About 11 Rather Than Wait For Coffee. The Youngest Of Our Party Was 13 So We Didn't Want Such A Late Night. We Were Brought The Wrong Food Several Times And Cheeses Came Long After The Other Desserts  So It Was Not A Relaxing Evening. ,,,,,,
,890,At Breakfast We Didn't Notice Any Fruit Juice Labels.  This Would Be Helpful For Dietary Requirements.,,,,,,
,891,It Was All Fine And Attentive.,,,,,,
,892,The Gala Dinner Food Was Better Than Expected Being Almost Fine Dining Standard - For Such Large Number Catering It Was Exceptional. Breakfast (Not Brunch?) Again Was Excellent  With A Very Good And Interesting Choice Of Dishes.,,,,,,
,893,We Ate In The Restaurant On The Saturday Night And The Service Was Very Good  The Food Was Fine But Not Outstanding. The Breakfast Service Seemed A Little Chaotic On The Sunday Morning But We Were In No Rush So That Didn't Matter And The Food Was Good. On Monday Morning The Service Was Much Better And The Food Was Good Again. ,,,,,,
,894,We Thought The Dinner Was Excellent And Interesting Especially For Me As A Vegetarian. To Have Such Choice Is Unusual.,,,,,,
,895,We Found The Food Improved On Our Last Visit - Which Was Great To See.  However Just A Couple Of Things To Note: Breakfasts - The Buffet Style Choice Was Most Improved And Didn't Run Out Of Things Such As The Pastries  If You Came Down Later To Breakfast.  The Cooked Breakfasts Were Good Too.  We Were There As Part Of The New Year Package And It Perhaps Might Have  Been An Idea To Give The Guests A Small Timetable Of Times For Meals (As Most Of Us Welcomed The Later Breakfast/Brunch Idea On New Year's Day But We Didn't Know About It Ahead Of Time)  We Were Also Unaware Of The Gin Tasting Session That Was Included In The Package But We Weren't Able To Join  As We Found Out About It Too Late.  Courtyard Gin Bar - The Recommendations On The Gins Were Excellent And We Really Enjoyed The Knowledge And The Recommends On Each Night.  We Did Dine There On One Of Our Nights And Had An Ok Meal........ It Would Have Been Nice To Have Seen Something A Little Lighter (Rather Than Just A Choice Of Burger Or Fish And Chips Or Pasta).  Also The Fish We Did Have Was Rather Over Cooked Which Made It Quite Dry.  Restaurant - Both The New Year Eve Package Dinners Were Interesting  But We Did Find It Hard To Make A Wine Choice For The New Year's Eve Dinner  As There Was Both The Need For A White And A Red Wine  But As There Was Only Two Of Us  We Didn't Want To Order Two Whole Bottles And Also The Toasting Champagne.  Could We Suggest That Perhaps You Included A Suggested Accompanying Wine By The Glass With Each Course  Which I Am Sure That A Number Of The Other Couples May Have Welcomed Too?  Your Wine List Has A Very Limited Number Of Wines By The Glass Or Even Half Bottles.  (Just One Small Point About The Canapes - It Would Have Been Nice To See Them Served With Paper Napkins - Everyone Was Dressed For Dinner And Had No Where To Wipe Sticky Fingers From The Canapes.)  We Do Love The Tea And Coffee Service - Please Do Keep This.  It Was Always Prompt And Beautifully Served.  ,,,,,,
,896,The Service Was A Bit Slow On Our First Night  However The Staff Were Apologetic And Sympathetic.,,,,,,
,897,Disappointed That Flora Or Other Non Dairy Spread Was Not Available At Breakfast. ,,,,,,
,898,Very Nice Food; However The Dinner Menu Was Almost Exactly The Same On Our Second Night  Which Was A Pity. This May Have Been Due To Dining In The Bar Or Because It Was The Weekend  Nevertheless It Would Have Been Nice To See A Completely Different Choice.,,,,,,
,899,Very Good Food ,,,,,,
,901,The Tasting Menu Was Good But Not Exciting - But There Were 2 Large Parties Dining That Night. The A La Carte We Had The Next Evening Was Excellent  Well Cooked And Presented.,,,,,,
,904,Food Was Very Good But Service Was Alright. No Muffins For The Eggs Benedict. ,,,,,,
,905,Dinner Fabulous Except For Very Slow Service. Breakfast Average. My Smoked Haddock Was Raw  Not Smoked!,,,,,,
,907,Please See Earlier Comments Regarding Service.,,,,,,
,909,It Would Have Been V Helpful If The Wine Waiter Had Actually Discussed The Wine Choices That Went With Each Course - Likewise At The Bar More Interaction About The Choice Of Gins Would Have Been Very Helpful.,,,,,,
,910,Our Main Meal And Wine Was Very Good  But Dessert Was Less Than Ideal.   It Was Not As Described On The Menu Or By The Waiter When Asked.  And When Questioned  The Waiter Was Somewhat Dismissive.  In Fairness  He Did Offer To Bring Another Dessert - But The Selection For Dessert Was Not Very Good So There Was Nothing Else We Wanted.   Also  After We Arrived And Settled In - I Came Downstairs To Make A Dinner Reservation With Reception.  When We Arrived For Dinner They Did Not Have Our Name Down On The Reservation List...The Wait Staff Seemed Confused And Hesitant.  Although Not A Big Deal...And They Sat Us ...It Was A Bit Offputting For The Beginning Of The Experience. ,,,,,,
,918,Waiting Staff Did Not Know Their Food  Tasting Menu Was Just Put Down And When Asked The Waiting Staff Did Not Know What The Dishes Were. Fish Course Was Served Cold. The Wine Flight Arrived After Each Course Rather Than Before Or With It. The Toast For Breakfast Arrived After Hot Food Finished Despite Asking For It With,,,,,,
,922,Evening Meal (5 Course Tasting Menu) Was Entirely Satisfactory  Good Rather Than Outstanding. Breakfast Service Was Very Slow (Though You Were Busy And The Food  Particularly The Bacon Was Very Dry. ,,,,,,
,925,See Earlier Comments!,,,,,,
,928,Dinner Seemed A Little Less 'Special' Than Previous Visits  More Straightforward Food But Still Good.,,,,,,
,929,Shall Return  In The Future - Better Than Expected,,,,,,
,932,None,,,,,,
,933,Whislt The Service In The Restuarant Was Friendly It Was Quite Slow And We Often Had To Ask Or Remind The Waitress Of Things
Eg.
- We Had To Ask Twice For Some Water
- Our Gins Did Not Arrive With The Starters For The Gin Fusion Menu - Again We Had To Ask
- At Breakfast We Waited A Long Time For A Waitress And Then She Asked For Our Order Before Even Showing Us The Menu
- When The Breakfast Arrived We Didn't Actually Get The Items We Had Asked For ,,,,,,
,934,Background Music Was Too Loud -- Not Really Necessary In Rooms With Such A Pleasant Ambience.

Proper Coat Hangers In The Bedroom Would Be Welcome.

It Was Not Clear Whether We Could Have Ordered Our Meal Over Drinks (Which We Prefer) Before Going In To Dinner.

To Nit Pick: Orange Juice At Breakfast Was Not Freshly Squeezed As Promised.,,,,,,
,935,The Egg Was Requested To Be Left Off One Of Our One Of My Dinner Courses  But It Came With The Egg.
The Black Pudding At Breakfast Was Under Cooked,,,,,,
,936,Please See Previous Comments Re Food. ,,,,,,
,937,No Cold Meats For Continental Breakfast?,,,,,,
,939,See Comment Above,,,,,,
,940,We Could Not Feel Any More Looked After,,,,,,
,941,Dining Area Lacking It Atmosphere  Too White/Bright  Need Muted Lighting In The Evening,,,,,,
,943,Waiter Service Was Very Professional And Attentive.,,,,,,
,944,Just One Young Female Waitress  Didn't Speak To Us At All And Rushed Us A Bit  Which We Really Only Noticed Because Everyone Else Was So Friendly And Polite. However I Must Add That This Did Not Have Any Real Impact On A Fabulous Dining Experience.,,,,,,
,945,The Gin Fusion Menu At Dinner Was A Brilliant Experience - Delicious Food And So Well Matched With The Different Gins. 
Breakfast Was Very Tasty Too - Our Only Quibble Was That Portion Size Was Not Especially Generous (I Chose Not To Have The Sausage  Bacon Or Black Pudding  So It Would Have Been Nice To Have Had A Second Egg).,,,,,,
,946,Did Not Like The Hash Brown At Breakfast,,,,,,
,947,We Had Burgers So The Word "Exceptional" Does Not Seem Appropriate,,,,,,
,949,Very Well Presented ,,,,,,
,951,Would Recommend That When Using The Private Dining Room That If Staying The Guests Using The Private Dining Room Are Put Above This Area Therefore Not Disturbing Other Guests Staying. ,,,,,,
,952,We Had A Very Enjoyable Meal But We Cannot Agree That It Was Exceptional,,,,,,
,962,The  Buffet Selection Was Disappointing  The Bacon Difficult To Eat And Egg Had So Much Pepper  I Couldn't Eat It.,,,,,,
,963,Breakfast Buffet Selection Was Disappointing The Bacon Difficult To Eat And Pepper Used Too Liberally On The Egg.,,,,,,
,967,Please See My Comments At The Start Of The Questionnaire,,,,,,
,968,Wasn't Sure What Cheese Charcuterie Was Available For Continental Breakfast,,,,,,
,,,,,,,,
