,Filters Applied,,,,,,,
,496,Our Dining Experience Was A Disappointment So Say The Least.  First Course 'Ham Hock Terrine' Was Exactly As It Said On The Tin I.E. Over Salty Ham Hock That Had Been Placed In A Terrine Dish.  No Bread Had Been Offered To Us - Had To Ask. After A Very Long Wait Our Second Course Arrived.  My Husband Enjoy His Chicken Infuse With Gin.  Memories Of My Assiette Of Pork Make Me Feel Queasy Even Now.  Some Pieces Were Undercooked And Cold And Other Just Very Unpleasant.  We Spoke With Our Server Who Tried His Best In The Situation And Offered Another Dish  Which I Refused.  Had No Desserts.  The Offending 'Pork' Was Deducted From The Bill.  Cancelled Our Table For Sunday Lunch. ,,,,,,
,498,The Dining Room Was A Little Chilly,,,,,,
,501,We Were Disappointed With The 5-Course Dining Experience As We Felt The Portions Were Extremely Small And The Gentlemen In Our Party Wanted To Go To The Pub Afterwards For Something Substanital To Eat! The Breakfast Was Also A Little Disappointing In That The Poaches Eggs On The Eggs Benedict Were Hardboiled Which Spoilt It A Little.,,,,,,
,505,I Felt That The Food Was Very Expensive And Very Small  And We ( My Sister And I) Are Not Big Eaters. The Food We Ate Was Delicious But For That Price Should Have Perhaps Included Some Vegetables .,,,,,,
,506,See My Previous Comments Re Our Dining Experience.,,,,,,
,511,Dinner Was Fantastic But Breakfast Was Poor .,,,,,,
,518,The Food Is Probably Very Good  But There Wasn't A Great Deal That Appealed To Me  I Had Pork And It Was A Little Dry  Our Starters Were Very Good.,,,,,,
,519,The Breakfast Service Was Better On The Friday Morning Than The Saturday.,,,,,,
,520,The Service Was Pleasant But Extremely Slow. At Breakfast We Had To Wait A Long Time Before Our Tea And Food Arrived. It Would Be A Good Idea To Serve The Drinks And Toast First  Prior To The Hot Breakfast. I Think They Were Short Staffed In The Morning. There Were No Pastries Although They Were On The Menu. The English Breakfast Would Have Benefited From Some Beans. We Had The Tasting Menu In The Evening. It Was Ok But We Were Left A Little Hungry.,,,,,,
,522,Gin Menu Fantastic,,,,,,
,523,The Portions Of Some Of The Dishes Were Quite Small E.G. There Was Only One Ravioli In The Starter.  It Was Tasty Though But There Could At Least Have Been Three Of Them.,,,,,,
,524,Very Impressed With Team For Accomodating For My Other Half Who Had A Fish Allergy At Such Short Notice.,,,,,,
,526,Waiting Staff Were Helpful And Friendly.  We Were A Little Baffled  As We Ordered Eggs Benedict For Breakfast But This Came With Spinach Which We Would Normally Be Called Eggs Florentine.  We Queried This But Were Told (Very Nicely) That This Was Eggs Benedict.  This Is Hardly A Life Threatening Experience But Just Slightly Odd.,,,,,,
,529,Breakfast Buffet Table On Sunday Morning 10.00Am Very Disappointing. No Pastries  No Individual Fruit Layer Yoghurts As Per Previous Visits  Run Out Of Fruit Salad  Buffet Table Covered In Crumbs And Used Weetabix Wrappers. Communal Yoghurt From Pot Very Thin And Low Quality. Whole Experience Smelled Of An Economy Drive By Hotel. Spoiled An Otherwise Excellent Stay. Wrong Lasting Impression To Give Guests Just Before They Depart.,,,,,,
,531,Amazing Puddings. The Eggs Benedict For Breakfast Was Phenomenal.,,,,,,
,545,Tuna Was Unavailable Once Ordered...Hash Browns Were Unavailable At Breakfast...Portions Very Small....Main Course Of Lamb Dull And Boring,,,,,,
,548,The Food Was Very Good And The Barman Very Knowledgeable About The Vaste Number Of Gin's! The Room Lacked A Little Atmospehere  Although Again  I Appreciate This Was Mid Week And Obviously Not Your Busiest Time. It's Such A Shame That You Are Unable To See The Bar From The Seating Area.,,,,,,
,549,The Fresh Fruit On Offer Needs To Be Greater And The Fruit Salad Topped Up Regularly.,,,,,,
,551,Fantastic Experience Couldn't Have Been Improved Upon,,,,,,
,553,The Whole Experience Is Very Good From Explaining All The Different Gins To Telling Us A Lovely Table By The Window Is Ready When We Were. We Have Previously Dined In The Restaurant And Both Menus Are Very Good  So Is The Food Of Course.,,,,,,
,554,We Found That The Sweets We Sampled Did Not Reach The High Standard Of The Rest Of The Meal.,,,,,,
,557,We Thoroughly Enjoyed Our Evening Meal The Food Was Lovely The Staff Very Nice Would Love To Eat There Again ,,,,,,
,558,Food Was Excellent.,,,,,,
,561,Took Two Hours To Serve Up The 3 Course Dinner. Service Was Slow On The Night We Stayed Due To A `Melt Down In The Kitchen. Staff Seemed Rushed. Bread Rolls Were Too Small. Forgot Our Side Dish.,,,,,,
,565,We Had The Gourmet Tasting Menu - We Feel That The Waiters Rushed Us Through The Courses - We Wanted To Make An Evening Of It.  Also Your Wine Waiter Filled Up Our Glasses To High - A Good Sommelier Would Refill The Glasses Gradually.  Pity Really As The Food Is Good And Well Presented.,,,,,,
,567,You Are Fortunate In Having The Services Of An Excellent Chef .,,,,,,
,571,The Dining Room Felt A Little Cold And Canteen Like.,,,,,,
,572,Particularly Liked Dining In The Courtyard In Summer.,,,,,,
,573,We Had The Taster Menu But Fennel Appeared To Feature More Than Once.  The First Half Of The Meal Was Served Almost Too Quickly And Then We Seemed To Wait A Long Time For The Final Courses During Which Time We Had Finished Our Wine And Water But Weren't Offered Anything Else.,,,,,,
,575,Eating Off A Slate (Roof Tile?) Is Not A Pleasant Experience And Doesn't Enhance The Look Or Taste Of The Food.  Cutlery Coming Into Contact With Slate ..... Very Unpleasant.  They Are Also Very Difficult For The Waiters To Pick Up When Clearing The Table.  Rather Too Many Smears And Blobs Decorating The Main Courses.  I Queried What I Thought Was A Missing Ingredient In One Course  Only To Be Told That It Was Present In The Form Of Two Penny-Sized Blobs Of Sauce.,,,,,,
,576,Waiting Staff A Bit Over-Attentive And Confused By Us Wanting To Try Different Gins.,,,,,,
,578,The Evening Meal Was Excellent  Breakfast Not So Good. The Service For Breakfast Was Slow And The Staff Seemed Harassed. The Toast Was Burnt On One Side And Uncooked On The Other. When I Pointed This Out To The Waitress She Was Quite Aggressive And Said The Toaster Had Broken And She Could Not Go Out And Buy A New Toaster As She Would Like To Because She Was Fed Up With The Situation. She Felt The Management Had Not Dealt With It Quickly Enough. I Appreciated Her Frustration But Was Unhappy With Her Tone To Me.,,,,,,
,582,At Dinner The Waiter Spilt A Bottle Of Tonic Water All Over The Table  Narrowly Missing Soaking And Ruining My Partner's Phone.  At Breakfast We Had To Ask Several Times For Cutlery  Tea Etc  Although It Was Not Busy.,,,,,,
,584,Items Not Available In The Menu Alternatives Offered But Different Things Served,,,,,,
,588,The Restaurant Staff Were All Well-Trained  Courteous And Helfpul. I Would Single Out The Barman/Sommelier/Waiter On The 25Th Who Served Us In The Gin Bar And Was Very Knowledgeable  Then Was Also Helpful With Food And Wine.,,,,,,
,589,The Food Was To A Very High 'Fine Dining' Standard. The Only Adverse Comment Was To Do With Our Drinks Canapã©S. These Were Delicious But We Found It Almost Impossible To Eat The Cream Cheese Quenelles. I Was Told We Should Use The Potato Wedge  However In My Case This Was Too Fragile And We Ended Up Trying To Enjoy The Cheese With A Cocktail Stick !! I Should Say This Is Merely A Comment And Not A Complaint. Over All The Food Superb The Best I've Had For A Long Time.,,,,,,
,591,I Considered The Wine To Be Very Expensive.  The Food Portions Of Food Were Woefully Inadequate. I And My Wife Had To Find Secondary Food Outlet As We Both Felt Hungry After The Meal. Not The Experience We Anticipated. Some Staff English Language Was Questionable.,,,,,,
,592,Worthy Of An Inclusion In The Gfg.,,,,,,
,595,The Breakfasts Were Alledgedly ''Cooked To Order''  Not The Case On Monday 6 May  Very Poor Quality  Extremely Dry As If It Had Been Heated Up.,,,,,,
,599,We Had The Gourment Experience For Dinner But Felt That We Would Go For The Al La Carte Meal Next Time As Felt That Not All Of The Food Was To Our Liking And Too Many Courses.,,,,,,
,605,The Dinner Was Nice But I Wouldn't Quite Call It 'Exceptional',,,,,,
,606,Ordering Of Dinner Was Rather Slow And Haphazard. I Had To Request The Wine List Twice. Staff Originally Tried To Seat Us In The Empty Courtyard Gin Bar For Dinner And Initially Told Us The Dining Room Was Full. After Complaining To The Manager We Were Moved Into The Dining Room. Breakfast Was A Rather Disappointing Affair As The Food Was Not Freshly Cooked As We Would Expect. Crockery Was More Fitting For A Cafã© And Not What We Are Used To At The Feathers.,,,,,,
,612,The Vegetarian Main Course Said Baked Celeriac - It Came As Baked Onion!,,,,,,
,621,Overall Good But My Husband Had Scallops To Start..But 1 Scallop And There Was Part Of Another Scallop On Plate...This As First Course Was Disappointing..Although Overall Food Good But Not As Good As Last Tie. Coffee And Chocs Excellent..But Did Cost 9.50.,,,,,,
,628,Would Have Liked A Little More Description Of Tasting Menu As Each Course Arrived.,,,,,,
,635,Excellent As Usual Thank You.,,,,,,
,636,We Have Been Coming To Your Hotel For Nearly 20 Years And This Time The Food Served Was Average/Gastro Pub At Best-Huge Disappointment Unlikely We Will Come Again Or Recommend To Our Friends Anymore-A Real Shame.,,,,,,
,637,With The Dessert I Found That The Crackling Candy On It Was Overwhelming & I Was Unable To Eat It Which Was Disappointing. When The Waiter Asked Why I Hadn't Eaten It & I Explained He Didn't Really Seem To Understand My Problem With It. He Just Removed The Plate With No Offer Of A Replacement Maybe Without The Crackling Candy Or Something Different. I Found That A Little Unusual As In Most Other Restaurants I Have Eaten If There Is A Problem The Staff Are Usually Quite Eager To Resolve Them. However The Rest Of My Meal & My Husbands Meal Also Were Very Enjoyable.,,,,,,
,639,As A First Class Hotel And At Your Prices I Think You Should Serve 'Real' Orange Juice At Breakfast -,,,,,,
,641,My Wife And I Thoroughly Enjoyed Dinner.  The Food At All Times Was Excellent And The Wine List Well Selected Including Some More Mature Wines In The Lower Price Brackets - A Rarity.  My Only Negative Observation Was That Service At Breakfast Was Slow - I Suspect All Guests Came Down At About The Same Time Which Was Too Much For The Two Staff.,,,,,,
,645,Enjoyed Evening Meal And Breakgast  Staff Particularly Friendly,,,,,,
,651,Thought Food And Service Were Excellent  My Only Comment (I Had 5 Course Gourmet) Is The Courses Did Come Out Too Quick  Would Have Been Nice To Have A Longer Delay. However I Must Also Comment That My Wife Just Wanted A Steak ( And The Package Included The 5 Course) This Was Accommodated With No Fuss And Was Much Appreciated.,,,,,,
,652,Seem Really Short Staff And There Was An Argument In The Kithcen And No Gin Tasting Menu Avaliable,,,,,,
,654,No,,,,,,
,655,The Taster Menu Was Rather Adventurous In Taste Values And In Future I Would Select From The A La Carte Menu (Which Is Probably A Safer  More Cautious Option),,,,,,
,659,There Was A Dog Wandering Round In The Courtyard Gin Bar.  We Understand That Dogs Are Not Allowed In The Restaurant  And Consider That The  Same Rule Should Apply In The Courtyard. We Sat By A Window And It Was A Bit Cold.,,,,,,
,660,I Appreciated The Different Wines Accompanying The Gourmet Menu - Thank You,,,,,,
,664,Ate In The Restaurant Both Nights.  Chose A La Carte First Night And The Chef Made An Alternative Tasting Menu The Second Evening So We Could Try Different Dishes.  It Was Absolutely Fabulous.  Head Chef Was Off That Night And His Number Two Certainly Didnt Let Him Down,,,,,,
,668,Good Was Very Good But Not Excellent. We Had The Taster Menu And I Was Told That We Could Choose Our Courses When Booking Which Wasn't The Case. One Waiter Was Friendly  The Other Was Quite Cold.,,,,,,
,669,You Asked Our Dietary Preferences In Advance And Then For The Main Lamb Course At Dinner Included Bacon In The Cabbage Which We Had Specifically Indicated We Did Not Eat . The Lamb Was Not As Described On The Menu No Cornish Pasty   No Cauliflower Cheese It Was Returned Reheated And Dry With Cabbage Not A Very Appealing Main Course  Starters Excellent Sweets Quite Good   The Polish Waiter Was Excellent As Was The Barman In The Gin Bar But The Head Waiter Seemed To Vanish After He Had Taken Our Order And Never Reappeared To Apologise For The Main Course Mistake. He  Left It To His Charming Junior  Breakfast Service Erratic And Inattentive Smoked Salmon Leathery But Otherwise Good Liked The Fresh Orange Juice,,,,,,
,670,Superb Food And Very Helpful And Friendly Staff Both At Dinner And At Breakfast.,,,,,,
,673,I Am Vegetarian And Found A Few Nice Things On The Menu For Dinner  But The One Night The Chef Created A Special Dish For Me  A Vegetable Tart (With Fennel And Leek) That Was Delicious! Also The Beetroot Salad Appetizer Was Lovely. All The Looseleaf Teas Are Wonderful. I Very Much Appreciate Those Too. In General I Would Have Liked There To Be More Vegetarian Choices But The Chef Was Very Accommodating. The Breakfasts Were Wonderful! Thank You.,,,,,,
,677,Lack Of Organisation In Restaurant. Glasses Moved By One Person Then Returned Etc . Hard To Know Who Was In Charge Though Individuals Polite. Very Small Portion Of Turbot. Breakfast Order Undercooked  Then Overcooked. Just Simple Soft Boiled Eggs. Told A Refresh Of Tea And Coffee At Breakfast Would Be 'Extra' . Astonishing At That Price/Standard Of Hotel.,,,,,,
,679,It Would Be Nice To Have Some Different Choices Of Menu Each Evening. For The Breakfast  Each Morning We Were Told No Hash Browns Were Available. I Can Understand That For The One Morning But Surely The Chef Could Prepare Some For The Following Morning They Are Not Difficult To Prepare.,,,,,,
,681,We Were So Looking Forward To Our Evening Meal Experience  We Chose The Share Option Beef At Â£50  Thinking It Was Going To Be So Nice  Sadly Our Beef Was Tough And Chewy But The Reast Was All Ok. So I Guess You Now Know We're Very Disappointed  And Would Not Recommend That Dish To Others. We Would Consider Recommending The Feathers To Friends But Not The Beef  Otherwise A Lovey Stay  Just A Shame About The Meal. Hopefully You May Invite Us Back To Rectify That. Regards,,,,,,
,683,We Ate A Superb Dinner. We Also Ate A Small Lunch And I Was Disappointed Not To Be Given The Bread With My Soup I Was Expecting  But Others Had Some So We Shared. The Waiter's English Was Not The Best And He Did Not Seem To Understand Our Comment About The Bread. Nothing Spoilt The Food Though It Was Great.,,,,,,
,684,Could Not Offer Butter Substitute Apart From Oil-Not Very Good With Toast & Preserves,,,,,,
,688,Questions Are A Bit Loaded. We Had A Really Good Dinner But It Was Not Exceptional. What Was Really Lovely Was To Be Able To Eat In The Garden. That Made The Evening Special.,,,,,,
,689,We Selected To Have The Wine Matching  And Quite Often The Empty Glasses From The Previous Glasses Were Left On Our Table  Even After The Next Wine Was Served. Why They Could Not Take Them Away  I'm Not Sure. Also  Just From A Business Point Of View  At No Point Did Any Staff Try To Upsell Or Attach Further Sale. With This  I Mean That I Am Used To Waiting Staff Suggesting Extras. So  No One Suggested That We Have The Pairing Wines  It Was My Initiative. Also  It Would Have Been Nice Is Someone Asked Us What Our Favorite Wine Was From The 5 We Had  And Asked If We Would Like A Bottle. Or Maybe Would We Like To Upgrade From The Gourmet Menu To The Tasting Menu. Even When We Were Outside Having A Drink In The Afternoon  When The Waiter/Barman Came To Collect Our Empty Glasses  He Never Asked If We Would Like Another Drink. These Are All Areas Where You Could Generate Further Revenue  And Also Make You Customers Feel Like That Are Getting Attentive Service.,,,,,,
,690,At Dinner The Service Was Average. The Food Was Excellent. The Music Playing In The Background Was Appalling.  We Had A Package With A Free Breakfast Included However We Were Not Informed As To Whether Coffee Or Juice Would Be Included Even After Asking The Waiter. The Service Was Average Again  Friendly But Seemed To Be A Bit Unsure.,,,,,,
,692,The Food Was Well Presented And Acceptable  While Not Outstanding.,,,,,,
,694,Just A Few Chef Comments' From A Constructive Point Overall We Were Extremely Impressed With The Ala Carte Menu That We Dined From On 2 Evenings As A Chef Of 35 Years Myself  I Feel Your Overall Aa Rating Of 2 Rosettes Is Justified  However Parts Of Our Meals Were Extremely Well Thought Out  Well Balanced And Cooked To Perfection And Imho Deserve A 3 Aa Rating  What Does Unfortunately Let You Down  Is Your Pastry Is Not Quite To The Level Of Your Starters & Mains  That's Not To Say That It Was Not Enjoyable  Apart From The Pistachio Cake Dessert  The 3 Other Desserts Ordered Were To A Good Standard.  I Would Also  If I May  Advise That A Little More Consistacy Be Paid To Your Breakfast. Our Cooked Breakfast On Our First Morning Was Excellent  However We Were Quite Disappointed On Our Second Morning  With Over Cooked And Non Seasoned Scrambled Eggs  And An Egg Benedictine That Was Somewhat Bizzare  Served On A Hard Toasted Bread Roll? Not An English Muffin As Would Expect  2 Very Undercooked Poached Eggs On Top Of Ham And Spinach? ( Spinach Is Egg Floretine) Hollandaise Sauce And Then Topped With Your Chefs Favourite Micro Cress.( Chef  Please Use In Moderation  As You'll Get Heavily Marked Down On Your Next Aa Visit  As It Formed Part Of Every Dish We Ate Over The Weekend) Otherwise A Most Enjoyable Restaurant Experience  Well Done To All The Catering Staff; You Have The Makings Of A Great Restaurant   ,,,,,,
,703,The Service Was Very Slow On Our First Night Having To Wait Nearly An Hour For Our Main Course! A Sorbet Was Offered!!,,,,,,
,705,Ar Dinner We Found The Service A Little Too Attentive And Way To Many 'You're Welcome' ..... Breakfast On The Other Hand Was A Little Lacking In Service In Regard To No Staff On Arrival & Having To Find One To Order Our Breakfast (He Was Clearing Tables...) We Were In A Bit Of A Hurry And When We Told Him He Was Very Accommodating.,,,,,,
,706,We Have Taken The Gin Menu Twice. The First Time It Was Exceptional  The Second It Appeared To Have Dropped In Quality (I Even Pointed Out Missing Items - Like Gin Jelly). Have You Changed Kitchen Staff&Gt;,,,,,,
,710,Food And Service Was Good During The Evening Meal  But The Bill Took Too Long To Arrive. (Over 10 Minutes)  This Is A Shame As It Leaves The Lasting Impression Of The Evening As Poor. The Bill Was Also The Wrong One For Our Table. Please Try To Get The Bill To Your Guests As Soon As They Ask For It  And Do Not Leave Them Waiting. The Breakfast Staff Were Polite But Very Slow At Getting Tea/Toast And Cooked Items Out. It Was A Shame As The Food Was Good.,,,,,,
,711,Breakfast Not S Good As Last Time. Not As Stylishly Presented. Toast Was Awful Hard And Dry And Brittle. Not Quick In Filling Fruit Yogurt Etc At Buffet Tasting Menu Dinner Was Good  Just 5- 10 Minutes Too Slow Between Courses. Whole Meal Was 2.5 Hours Therefore Half An Hour Per Course When Only Tasting Portions - Needs To Be Quicker. Sevice Was Pleasant But A Little Perfuntory. No Interaction,,,,,,
,714,One Of The Best !,,,,,,
,716,Very Limited Menu.,,,,,,
,720,Scallops Was A Full Scallop And A Piece Of Scallop Which Is Not Very Clever Of You! Not Sure Why At Least 2 Full Scallops Were Served.  A Starter Portion Is Normally 3 And At Â£12 You Are At The Top Of The Pricing!,,,,,,
,721,Tasting Menu ...Most Courses Were Put On The Table Without Explanation Of The Content. Breakfast Was Very Slow Service And When It Did Arrive Only Half Of My Choice Arrived. The Buffet Was Depleted And Not Replenished.,,,,,,
,724,My Aunt And Uncle Are Still Talking About The Tasting Menu And How They Very Much Enjoyed It !!!!,,,,,,
,728,Wonderful Food Although A Tad Repetive In The Eveing.,,,,,,
,729,We Were Very Disappointed With The Taster Menu. Sorry To Say But The Meal Was Such A Let Down  Most Of The Courses Came With The Same Micro Salad Garnish  Service Was Good But Rather Rushed. We Asked For A Few Minutes Break Before The Next Course But It Still Arrived Within 2 Mins Of The Last One Breakfast: Was The Scrambled Egg Made Up From A Powder  It Did Not Look Taste Or Feel Like Fresh Eggs  We Would Love To Come And Stay Again But Don't Think We Would Eat In The Resturant,,,,,,
,735,The Service Was Very Hit And Miss. At Times It Was Over Zealous. At Other Times There Was No One To Be Seen. The Music In The Dining Room Was The Same Eric Clapton Tune Over And Over Again. It Was The Same Music At Breakfast.,,,,,,
,742,No.,,,,,,
,743,The Service Was Slow At Times,,,,,,
,746,We Had The 5 Course Gourmet Menu Which Was Interesting  But The Salmon Course Was Cold And Very Rare.,,,,,,
,752,Superb In Every Way,,,,,,
,754,The Breakfast Was A Little Overcooked As Though It Had Been Kept Warm Rather Then Cooked Fresh.,,,,,,
,755,Accomplished Cooking And Excellent Service. Altogether A Very Enjoyable Experience. Very Good Winelist.,,,,,,
,759,Honestly  We Were Disappointed. I Ordered A Martini As An Aperitif And You Had No Vermouth...In A Gin Bar! The Staff Were Mixed In Their Experience...The Young Ones Needed More Training Re: Pouring Wine/Where To Place Items. A Course Was Brought To Us And The Table Hadn't Been Cleared From The Previous Course.  The Breakfast On Sunday Morning Was Incredibly Slow.,,,,,,
,762,None Other Than Already Mentioned. I Will Be Back!,,,,,,
,763,Gin Fusion Menu Was Fantastic. I've Never Been A Gin Drinker But I Am Now Converted!,,,,,,
,766,We Had The Five Course Taster Meal. The Food Was Of A High Quality But Very Small Quantities. We Both Felt Like We Could Have Eaten Alot More. Please Note Either Of Us Have Big Appetites And Have Eaten Many Taster Menus At Other Restaurants. My Husband Did Ask To See If The Chef Could Cook Him A Further Large Course Such As Steak But The Kitchen Had Shut And They Could Only Offer A Cheeseboard. When Ordering Wine I Asked For A Bottle Of Veuve Cliquot And Pointed To The Exact Type On The Wine List. However  When The Bottle Arrived At The Table It Was Presented To My Husband Whom Assumed That Was What I Chose And Accepted It. However We Had Been Brought The Vintage Which Was Â£25 More. We Didnt Realise This Untill We Checked The Bill On Leaving The Hotel. I Do Hope This Was A Genuine Mistake And Not The Hotel Trying To Upsell. We Arrived At Breakfast At 9.45Am And Were Asked To Sit At A Table With Crumbs And Place Settings From The Previous Customers Which The Waiter Cleaned Up As I Sat There. I Couldnt See Why I Couldnt Have Been Sat At A Clean Table? The Breakfast Was Disappointing Apart From The Staff Who Were Very Friendly And Attentive. I Received The Wrong Fruit Juice  The Toast Was White Not Brown  The Kitchen Had Run Out Of Bananas For The Hotcake And Banana. As A Consequence We Were Offered Berries In The Hotcakes Instead. What Came Was A Dry Hotcake With A Very Slight Smear Of Jam Inside. The Coffee Was Extremely Weak Unlike The Coffee I Had The Night Before.   ,,,,,,
,767,The Issue With The Food Was That It Took Over An Hour To Be Served After Ordering. Far To Long Especially As Other Tables Were Served Before Us Although They Arrived After Us. We Had No Dietary Requirements So I Don't Know Why It Took So Long,,,,,,
,771,Some Was Exceptional  Some Less So.  Some Staff Were Great (Tall Chap With Glasses Who Was Gin Expert Went The Extra Mile) Others Less So. Had To Wait 20 Mins For Cup Of Tea At Table One Morning.,,,,,,
,774,We Were Very Disappointed With The Food In The Evening. Lobster Ravioli Was Completely Tasteless As Were The Vegetables Served With The Lamb.  The Restaurant Manager Seemed Rather Harassed And Service Was A Bit Haphazard.,,,,,,
,779,Disappointed. One Starter Was Served With Blue Cheese Missing. Lobster Ravioli Had Little Lobster Filling And Was Tasteless. Not Asked To Taste The Wine And Was Not Poured. The Serving Staff Need More Training.,,,,,,
,787,As Part Of Our 123 Package The Offer Stated That We Had A Complimentary Gin Cocktail. My Wife And I Are Not Particularly Gin Drinkers But The Gentleman Running The Bar Mentioned That We Could Have Any Other Drink We Liked And Offered My Wife A Glass Of Champagne. Superb  As That Is Her Favourite Drink. I Had A Glass Of Red Wine. That Was A Welcome And Delightful Start To Our Meal With You. Thank You.  ,,,,,,
,788,The Food Was Lovely. One Of The Staff Forgot To Clear Our Plates Away After The Entree But We Laughed It Off When The Mains Arrived And The Staff Were Trying To Serve Our Food.  They Were Apologetic But Very Polite And Dealt With It.  It Didn't Ruin Our Experience.  Staff Were Discreet But Attentive.,,,,,,
,796,As Above Breakfast Buffet Was Lacking,,,,,,
,797,See Previous Comments,,,,,,
,801,Again  Superb. Beautifully Presented And Well Cooked.,,,,,,
,803,First Night We Were Told The Chicken Was Off The Menu   Second Night Still Off The Menu We Were Told That The Chef Was Changing The Menus And That Was The Reason.  Poached Egg Must Have A Piece Of Toast Under It  Surely Not Just Put On The Plate.  ,,,,,,
,804,Friendly Staff  We Really Liked The Barman From Poland  He Introduced Us To Two New Gins.,,,,,,
,805,Extremely Good Service.,,,,,,
,806,The Bacon And Sausage Were Very Dry And Appeared To Have Been Kept Warm As Opposed Freshly Cooked. ,,,,,,
,813,The Gentlemen Who We Served Us At Breakfast Was Delightful,,,,,,
,814,Very Good Food And Service Served To A Very High Standard.,,,,,,
